{"apiVersion":"patroni.pgsty.com/v1alpha1","kind":"VersionInfo","metadata":{"requestId":"machine-schema-example","observedAt":"2026-07-13T12:34:56Z","warnings":[]},"data":{"version":"example","commit":"example","buildTime":"example","goVersion":"example","supportedPatroni":">=3.0.0,<5.0.0","machineSchema":"patroni.pgsty.com/v1alpha1","application":{"name":"node-a","version":"example","commit":"example","buildTime":"example","goVersion":"example","supportedPatroni":">=3.0.0,<5.0.0"},"members":[{"target":{"context":"default","namespace":"/service","scope":"alpha","group":1,"member":"node-a"},"patroniVersion":"example","postgresVersion":"example","httpStatus":1,"error":{"category":"USAGE","operation":"example","target":{"context":"default","namespace":"/service","scope":"alpha","group":1,"member":"node-a"},"retryable":false,"cause":"INVALID_INPUT","message":"example","evidence":[{"source":"LOCAL","observedAt":"2026-07-13T12:34:56Z","summary":"example","revision":"example","path":"/patroni","sendState":"ACCEPTED"}],"nextActions":["example"]}}]}}
